{
  "schema_version": "abb.trace.v1",
  "trace_id": "trc_demo_dispatch",
  "run_id": "run_demo_incident_triage",
  "app": "incident-triage-agent",
  "started_at": "2026-08-18T11:15:00Z",
  "metadata": {
    "model": "example-agent",
    "environment": "local-demo"
  },
  "events": [
    {
      "id": "evt_001",
      "kind": "run_started",
      "timestamp": "2026-08-18T11:15:00Z",
      "actor": "agent",
      "summary": "Agent run started",
      "payload": {
        "metadata": {
          "model": "example-agent"
        }
      },
      "parent_id": null,
      "tags": []
    },
    {
      "id": "evt_002",
      "kind": "observation",
      "timestamp": "2026-08-18T11:15:03Z",
      "actor": "agent",
      "summary": "User reported a payment webhook outage",
      "payload": {
        "channel": "ops",
        "severity": "high"
      },
      "parent_id": null,
      "tags": [
        "input"
      ]
    },
    {
      "id": "evt_003",
      "kind": "decision",
      "timestamp": "2026-08-18T11:15:08Z",
      "actor": "agent",
      "summary": "Classify incident as integration failure",
      "payload": {
        "rationale": "Recent deploy touched webhook retry logic.",
        "alternatives": [
          "provider outage",
          "database latency"
        ]
      },
      "parent_id": null,
      "tags": [
        "triage"
      ]
    },
    {
      "id": "evt_004",
      "kind": "permission",
      "timestamp": "2026-08-18T11:15:10Z",
      "actor": "agent",
      "summary": "Permission allowed: search_incidents",
      "payload": {
        "capability": "search_incidents",
        "allowed": true,
        "reason": "Read-only diagnostic search."
      },
      "parent_id": null,
      "tags": []
    },
    {
      "id": "evt_005",
      "kind": "tool_call",
      "timestamp": "2026-08-18T11:15:11Z",
      "actor": "agent",
      "summary": "Tool call: search_incidents",
      "payload": {
        "name": "search_incidents",
        "request": {
          "query": "webhook retry failure"
        },
        "response": {
          "matches": [
            "INC-421",
            "INC-422"
          ]
        },
        "status": "ok",
        "duration_ms": 112,
        "requires_permission": true
      },
      "parent_id": null,
      "tags": [
        "tool"
      ]
    },
    {
      "id": "evt_006",
      "kind": "artifact",
      "timestamp": "2026-08-18T11:15:22Z",
      "actor": "agent",
      "summary": "Artifact captured: incident-summary",
      "payload": {
        "path": "out/incident-summary.md",
        "label": "incident-summary",
        "exists": true,
        "bytes": 820
      },
      "parent_id": null,
      "tags": [
        "artifact"
      ]
    },
    {
      "id": "evt_007",
      "kind": "run_finished",
      "timestamp": "2026-08-18T11:15:29Z",
      "actor": "agent",
      "summary": "Agent run finished",
      "payload": {
        "status": "completed"
      },
      "parent_id": null,
      "tags": []
    }
  ]
}
